{
 "engine": "rule_engine_1s",
 "lat": 0.1,
 "spot_lag": 1.44,
 "rules": {
  "H20261030-01": {
   "per_day": {
    "20260926": {
     "trades": 25,
     "cost": 125.0,
     "gross": 0.305,
     "fees": 0.35,
     "net": -0.045,
     "rounds": 288
    },
    "20260927": {
     "trades": 25,
     "cost": 125.0,
     "gross": 0.36,
     "fees": 0.35,
     "net": 0.01,
     "rounds": 288
    },
    "20260928": {
     "trades": 25,
     "cost": 125.0,
     "gross": -0.444,
     "fees": 0.35,
     "net": -0.794,
     "rounds": 288
    },
    "20260929": {
     "trades": 25,
     "cost": 125.0,
     "gross": 1.724,
     "fees": 0.35,
     "net": 1.374,
     "rounds": 288
    },
    "20260930": {
     "trades": 25,
     "cost": 125.0,
     "gross": 1.826,
     "fees": 0.35,
     "net": 1.476,
     "rounds": 288
    },
    "20261001": {
     "trades": 25,
     "cost": 125.0,
     "gross": 2.006,
     "fees": 0.35,
     "net": 1.656,
     "rounds": 288
    },
    "20261002": {
     "trades": 25,
     "cost": 125.0,
     "gross": 0.456,
     "fees": 0.35,
     "net": 0.106,
     "rounds": 288
    },
    "20261003": {
     "trades": 25,
     "cost": 125.0,
     "gross": 1.13,
     "fees": 0.35,
     "net": 0.78,
     "rounds": 288
    },
    "20261004": {
     "trades": 25,
     "cost": 125.0,
     "gross": 2.955,
     "fees": 0.35,
     "net": 2.605,
     "rounds": 288
    }
   },
   "trades": [
    {
     "day": "20260926",
     "start": 1758862800,
     "side": "Up",
     "t_el": 220,
     "leg": "taker",
     "price": 0.72,
     "size": 6.94,
     "fill": "full",
     "fee": 0.0979,
     "winner": "Up",
     "pnl": 1.845,
     "R": 0.369,
     "ctx": {
      "spot_bps_vs_open": 5.1
     }
    },
    {
     "day": "20260927",
     "start": 1758863100,
     "side": "Up",
     "t_el": 220,
     "leg": "taker",
     "price": 0.72,
     "size": 6.94,
     "fill": "full",
     "fee": 0.0979,
     "winner": "Up",
     "pnl": 1.845,
     "R": 0.369,
     "ctx": {
      "spot_bps_vs_open": 5.1
     }
    },
    {
     "day": "20260928",
     "start": 1758863400,
     "side": "Up",
     "t_el": 220,
     "leg": "taker",
     "price": 0.72,
     "size": 6.94,
     "fill": "full",
     "fee": 0.0979,
     "winner": "Up",
     "pnl": 1.845,
     "R": 0.369,
     "ctx": {
      "spot_bps_vs_open": 5.1
     }
    }
   ],
   "fit": {
    "net_per_dollar": 0.006,
    "ci95": [
     -0.014,
     0.026
    ],
    "n": 67
   },
   "test": {
    "net_per_dollar": 0.004,
    "ci95": [
     -0.009,
     0.017
    ],
    "n": 75
   },
   "windows": [
    {
     "fit": [
      "20260926",
      "20260927",
      "20260928",
      "20260929",
      "20260930",
      "20261001"
     ],
     "test": [
      "20261002",
      "20261003",
      "20261004"
     ],
     "net_per_dollar": 0.0142,
     "n": 15
    },
    {
     "fit": [
      "20260927",
      "20260928",
      "20260929",
      "20260930",
      "20261001",
      "20261002"
     ],
     "test": [
      "20261003",
      "20261004",
      "20261005"
     ],
     "net_per_dollar": 0.0052,
     "n": 15
    },
    {
     "fit": [
      "20260928",
      "20260929",
      "20260930",
      "20261001",
      "20261002",
      "20261003"
     ],
     "test": [
      "20261004",
      "20261005",
      "20261006"
     ],
     "net_per_dollar": 0.0052,
     "n": 15
    },
    {
     "fit": [
      "20260929",
      "20260930",
      "20261001",
      "20261002",
      "20261003",
      "20261004"
     ],
     "test": [
      "20261005",
      "20261006",
      "20261007"
     ],
     "net_per_dollar": 0.0182,
     "n": 15
    },
    {
     "fit": [
      "20260930",
      "20261001",
      "20261002",
      "20261003",
      "20261004"
     ],
     "test": [
      "20261006",
      "20261007",
      "20261008"
     ],
     "net_per_dollar": 0.0014,
     "n": 15
    }
   ],
   "mc_dd": {
    "p50": 6.2,
    "p95": 7.4,
    "n": 1000
   },
   "fill_model": "taker_ask_ok_100ms"
  },
  "H20261030-02": {
   "per_day": {
    "20260926": {
     "trades": 6,
     "cost": 30.0,
     "gross": -1.279,
     "fees": 0.084,
     "net": -1.363,
     "rounds": 288
    },
    "20260927": {
     "trades": 6,
     "cost": 30.0,
     "gross": 0.526,
     "fees": 0.084,
     "net": 0.442,
     "rounds": 288
    },
    "20260928": {
     "trades": 6,
     "cost": 30.0,
     "gross": -0.188,
     "fees": 0.084,
     "net": -0.272,
     "rounds": 288
    },
    "20260929": {
     "trades": 6,
     "cost": 30.0,
     "gross": -0.866,
     "fees": 0.084,
     "net": -0.95,
     "rounds": 288
    },
    "20260930": {
     "trades": 6,
     "cost": 30.0,
     "gross": 0.476,
     "fees": 0.084,
     "net": 0.392,
     "rounds": 288
    },
    "20261001": {
     "trades": 6,
     "cost": 30.0,
     "gross": -1.072,
     "fees": 0.084,
     "net": -1.156,
     "rounds": 288
    },
    "20261002": {
     "trades": 6,
     "cost": 30.0,
     "gross": 0.124,
     "fees": 0.084,
     "net": 0.04,
     "rounds": 288
    },
    "20261003": {
     "trades": 6,
     "cost": 30.0,
     "gross": -1.156,
     "fees": 0.084,
     "net": -1.24,
     "rounds": 288
    },
    "20261004": {
     "trades": 6,
     "cost": 30.0,
     "gross": -1.4,
     "fees": 0.084,
     "net": -1.484,
     "rounds": 288
    }
   },
   "trades": [
    {
     "day": "20260926",
     "start": 1758862800,
     "side": "Up",
     "t_el": 220,
     "leg": "taker",
     "price": 0.72,
     "size": 6.94,
     "fill": "full",
     "fee": 0.0979,
     "winner": "Up",
     "pnl": 1.845,
     "R": 0.369,
     "ctx": {
      "spot_bps_vs_open": 5.1
     }
    },
    {
     "day": "20260927",
     "start": 1758863100,
     "side": "Up",
     "t_el": 220,
     "leg": "taker",
     "price": 0.72,
     "size": 6.94,
     "fill": "full",
     "fee": 0.0979,
     "winner": "Up",
     "pnl": 1.845,
     "R": 0.369,
     "ctx": {
      "spot_bps_vs_open": 5.1
     }
    },
    {
     "day": "20260928",
     "start": 1758863400,
     "side": "Up",
     "t_el": 220,
     "leg": "taker",
     "price": 0.72,
     "size": 6.94,
     "fill": "full",
     "fee": 0.0979,
     "winner": "Up",
     "pnl": 1.845,
     "R": 0.369,
     "ctx": {
      "spot_bps_vs_open": 5.1
     }
    }
   ],
   "fit": {
    "net_per_dollar": -0.018,
    "ci95": [
     -0.038,
     0.002
    ],
    "n": 17
   },
   "test": {
    "net_per_dollar": -0.012,
    "ci95": [
     -0.025,
     0.001
    ],
    "n": 19
   },
   "windows": [
    {
     "fit": [
      "20260926",
      "20260927",
      "20260928",
      "20260929",
      "20260930",
      "20261001"
     ],
     "test": [
      "20261002",
      "20261003",
      "20261004"
     ],
     "net_per_dollar": -0.0184,
     "n": 3
    },
    {
     "fit": [
      "20260927",
      "20260928",
      "20260929",
      "20260930",
      "20261001",
      "20261002"
     ],
     "test": [
      "20261003",
      "20261004",
      "20261005"
     ],
     "net_per_dollar": -0.0314,
     "n": 3
    },
    {
     "fit": [
      "20260928",
      "20260929",
      "20260930",
      "20261001",
      "20261002",
      "20261003"
     ],
     "test": [
      "20261004",
      "20261005",
      "20261006"
     ],
     "net_per_dollar": -0.0048,
     "n": 3
    },
    {
     "fit": [
      "20260929",
      "20260930",
      "20261001",
      "20261002",
      "20261003",
      "20261004"
     ],
     "test": [
      "20261005",
      "20261006",
      "20261007"
     ],
     "net_per_dollar": -0.0148,
     "n": 3
    },
    {
     "fit": [
      "20260930",
      "20261001",
      "20261002",
      "20261003",
      "20261004"
     ],
     "test": [
      "20261006",
      "20261007",
      "20261008"
     ],
     "net_per_dollar": -0.0343,
     "n": 3
    }
   ],
   "mc_dd": {
    "p50": 6.2,
    "p95": 12.1,
    "n": 1000
   },
   "fill_model": "taker_ask_ok_100ms"
  },
  "H20261030-03": {
   "per_day": {
    "20260926": {
     "trades": 7,
     "cost": 35.0,
     "gross": 0.607,
     "fees": 0.098,
     "net": 0.509,
     "rounds": 288
    },
    "20260927": {
     "trades": 7,
     "cost": 35.0,
     "gross": 0.805,
     "fees": 0.098,
     "net": 0.707,
     "rounds": 288
    },
    "20260928": {
     "trades": 7,
     "cost": 35.0,
     "gross": 0.83,
     "fees": 0.098,
     "net": 0.732,
     "rounds": 288
    },
    "20260929": {
     "trades": 7,
     "cost": 35.0,
     "gross": 0.87,
     "fees": 0.098,
     "net": 0.772,
     "rounds": 288
    },
    "20260930": {
     "trades": 7,
     "cost": 35.0,
     "gross": 0.291,
     "fees": 0.098,
     "net": 0.193,
     "rounds": 288
    },
    "20261001": {
     "trades": 7,
     "cost": 35.0,
     "gross": 0.432,
     "fees": 0.098,
     "net": 0.334,
     "rounds": 288
    },
    "20261002": {
     "trades": 7,
     "cost": 35.0,
     "gross": 0.772,
     "fees": 0.098,
     "net": 0.674,
     "rounds": 288
    },
    "20261003": {
     "trades": 7,
     "cost": 35.0,
     "gross": 0.483,
     "fees": 0.098,
     "net": 0.385,
     "rounds": 288
    },
    "20261004": {
     "trades": 7,
     "cost": 35.0,
     "gross": 0.095,
     "fees": 0.098,
     "net": -0.003,
     "rounds": 288
    }
   },
   "trades": [
    {
     "day": "20260926",
     "start": 1758862800,
     "side": "Up",
     "t_el": 220,
     "leg": "taker",
     "price": 0.72,
     "size": 6.94,
     "fill": "full",
     "fee": 0.0979,
     "winner": "Up",
     "pnl": 1.845,
     "R": 0.369,
     "ctx": {
      "spot_bps_vs_open": 5.1
     }
    },
    {
     "day": "20260927",
     "start": 1758863100,
     "side": "Up",
     "t_el": 220,
     "leg": "taker",
     "price": 0.72,
     "size": 6.94,
     "fill": "full",
     "fee": 0.0979,
     "winner": "Up",
     "pnl": 1.845,
     "R": 0.369,
     "ctx": {
      "spot_bps_vs_open": 5.1
     }
    },
    {
     "day": "20260928",
     "start": 1758863400,
     "side": "Up",
     "t_el": 220,
     "leg": "taker",
     "price": 0.72,
     "size": 6.94,
     "fill": "full",